{
  "$schema": "./profile-lock.schema.json",
  "schemaVersion": "0.1.0",
  "generatedBy": "node scripts/profile-pack.mjs lock --write",
  "profileFiles": [
    "docs/profiles/default.profile.json",
    "docs/profiles/full.profile.json",
    "docs/profiles/proxy-provider.profile.json",
    "docs/profiles/workspace.profile.json"
  ],
  "profiles": [
    {
      "id": "default",
      "source": "docs/profiles/default.profile.json",
      "sha256": "2fa0e8dd2f9e4d05b5faa40eed846f9d22ccd8f776a726bc1c65d7b0ea2d9796",
      "packages": [
        "git:github.com/zzanghyunmoo/oh-my-pi",
        "npm:pi-clear"
      ],
      "extensions": [
        "./extensions/env-loader",
        "./extensions/quotio-provider",
        "./extensions/workspace-connectors",
        "./extensions/setup-doctor"
      ],
      "enabledToggles": [],
      "secretRefNames": [],
      "connectors": [],
      "providers": [],
      "skills": [
        "./skills"
      ],
      "prompts": [
        "./prompts"
      ],
      "themes": [
        "./themes"
      ]
    },
    {
      "id": "full",
      "source": "docs/profiles/full.profile.json",
      "sha256": "bc3afcf94073059ef28d3bd8b752c7bb5de89553cc1bdc7b0abb35c258e7f0ab",
      "packages": [
        "git:github.com/zzanghyunmoo/oh-my-pi",
        "npm:pi-web-access",
        "npm:@leing2021/super-pi",
        "npm:pi-clear"
      ],
      "extensions": [
        "./extensions/env-loader",
        "./extensions/quotio-provider",
        "./extensions/workspace-connectors",
        "./extensions/setup-doctor"
      ],
      "enabledToggles": [
        "ENABLE_WORKSPACE_CONNECTORS=true",
        "ENABLE_QUOTIO=true"
      ],
      "secretRefNames": [
        "ENABLE_WORKSPACE_CONNECTORS",
        "ENABLE_QUOTIO",
        "QUOTIO_BASE_URL",
        "QUOTIO_API_KEY"
      ],
      "connectors": [
        "linear",
        "notion",
        "github",
        "gitlab",
        "jira",
        "confluence"
      ],
      "providers": [
        "quotio"
      ],
      "skills": [
        "./skills"
      ],
      "prompts": [
        "./prompts"
      ],
      "themes": [
        "./themes"
      ]
    },
    {
      "id": "proxy-provider",
      "source": "docs/profiles/proxy-provider.profile.json",
      "sha256": "50a4f32cc9d0bb062edbea4aecc2cad4d3df51f362dc4cc1e03b00a9a1d79806",
      "packages": [
        "git:github.com/zzanghyunmoo/oh-my-pi",
        "npm:pi-clear"
      ],
      "extensions": [
        "./extensions/env-loader",
        "./extensions/quotio-provider",
        "./extensions/workspace-connectors",
        "./extensions/setup-doctor"
      ],
      "enabledToggles": [
        "ENABLE_QUOTIO=true"
      ],
      "secretRefNames": [
        "ENABLE_QUOTIO",
        "QUOTIO_BASE_URL",
        "QUOTIO_API_KEY"
      ],
      "connectors": [],
      "providers": [
        "quotio"
      ],
      "skills": [
        "./skills"
      ],
      "prompts": [
        "./prompts"
      ],
      "themes": [
        "./themes"
      ]
    },
    {
      "id": "workspace",
      "source": "docs/profiles/workspace.profile.json",
      "sha256": "f56dfe50daa2838b524310fdec357d927b20cd872f60da9e23a0e9d1da50a4f3",
      "packages": [
        "git:github.com/zzanghyunmoo/oh-my-pi",
        "npm:pi-web-access",
        "npm:@leing2021/super-pi",
        "npm:pi-clear"
      ],
      "extensions": [
        "./extensions/env-loader",
        "./extensions/quotio-provider",
        "./extensions/workspace-connectors",
        "./extensions/setup-doctor"
      ],
      "enabledToggles": [
        "ENABLE_WORKSPACE_CONNECTORS=true"
      ],
      "secretRefNames": [
        "ENABLE_WORKSPACE_CONNECTORS"
      ],
      "connectors": [
        "linear",
        "notion",
        "github",
        "gitlab",
        "jira",
        "confluence"
      ],
      "providers": [],
      "skills": [
        "./skills"
      ],
      "prompts": [
        "./prompts"
      ],
      "themes": [
        "./themes"
      ]
    }
  ]
}
